{
  "status": "FAIL",
  "completion_allowed": false,
  "delegate_result_check": {
    "ok": true
  },
  "plan_a_check": {
    "ok": false,
    "reason": "API leaf docs missing."
  },
  "findings": [
    {
      "id": "index_content_sink",
      "severity": "hard",
      "message": "API index contains substantive endpoint reference material that belongs in leaf docs.",
      "affected_paths": [
        "docs/api/index.md"
      ],
      "repair_required": true
    },
    {
      "id": "category_under_split",
      "severity": "hard",
      "message": "API docs are under-split; expected leaf docs for orders, payments, auth, errors, and webhooks.",
      "affected_paths": [
        "docs/api/index.md"
      ],
      "repair_required": true
    }
  ]
}
