{
  "status": "FAIL",
  "completion_allowed": false,
  "delegate_result_check": {
    "ok": false,
    "missing": [
      "planner",
      "validator"
    ]
  },
  "plan_a_check": {
    "ok": false,
    "reason": "Planner delegate result missing."
  },
  "findings": [
    {
      "id": "delegate_result_missing",
      "severity": "hard",
      "message": "Delegated Planner and Validator stages have no explicit result.",
      "affected_paths": [],
      "repair_required": true
    },
    {
      "id": "delegate_wait_bypassed",
      "severity": "hard",
      "message": "Leader advanced after delegation without waiting for delegate results.",
      "affected_paths": [],
      "repair_required": true
    }
  ]
}
