{
  "status": "FAIL",
  "completion_allowed": false,
  "delegate_result_check": {
    "ok": true
  },
  "plan_a_check": {
    "ok": false,
    "reason": "Plan A is incomplete and delegates discovery to Workers."
  },
  "findings": [
    {
      "id": "planner_underplanning",
      "severity": "hard",
      "message": "Planner omitted obvious required API/data/infra leaf docs.",
      "affected_paths": [
        "docs/index.md"
      ],
      "repair_required": true
    },
    {
      "id": "delegated_discovery_to_worker",
      "severity": "hard",
      "message": "Planner assigned document discovery to Workers instead of producing Plan A.",
      "affected_paths": [],
      "repair_required": true
    }
  ]
}
